{
 "schema_version": "render-semantics.v1",
 "extractor_version": "pymupdf-page-ir.v1",
 "pdf": "group_label_also_edge_label.pdf",
 "pdf_sha256": "434d855b9b6db6da93e4c45feda1e1c179564934891355d105f40c60192f2e9a",
 "manifest": "group_label_also_edge_label.artifacts.json",
 "page_count": 1,
 "normalization": {
  "coordinate_space": "page_points",
  "origin": "top_left",
  "float_precision": 6,
  "normalized_axes": [
   "x_norm",
   "y_norm"
  ]
 },
 "pages": [
  {
   "page_index": 0,
   "width": 164.434006,
   "height": 92.764999,
   "bbox": {
    "x0": 0.0,
    "y0": 0.0,
    "x1": 164.434006,
    "y1": 92.764999,
    "width": 164.434006,
    "height": 92.764999,
    "x0_norm": 0.0,
    "y0_norm": 0.0,
    "x1_norm": 1.0,
    "y1_norm": 1.0
   },
   "drawings": [
    {
     "primitive_id": "drawing-0",
     "seqno": 0,
     "type": "s",
     "rect": {
      "x0": 20.882038,
      "y0": 4.582288,
      "x1": 54.387959,
      "y1": 27.259708,
      "width": 33.505921,
      "height": 22.67742,
      "x0_norm": 0.126993,
      "y0_norm": 0.049397,
      "x1_norm": 0.330759,
      "y1_norm": 0.293858
     },
     "items": [
      {
       "op": "l",
       "args": [
        {
         "x": 52.395397,
         "y": 4.582288,
         "x_norm": 0.318641,
         "y_norm": 0.049397
        },
        {
         "x": 22.874599,
         "y": 4.582288,
         "x_norm": 0.139111,
         "y_norm": 0.049397
        }
       ]
      },
      {
       "op": "c",
       "args": [
        {
         "x": 22.874599,
         "y": 4.582288,
         "x_norm": 0.139111,
         "y_norm": 0.049397
        },
        {
         "x": 21.774128,
         "y": 4.582288,
         "x_norm": 0.132419,
         "y_norm": 0.049397
        },
        {
         "x": 20.882038,
         "y": 5.474378,
         "x_norm": 0.126993,
         "y_norm": 0.059013
        },
        {
         "x": 20.882038,
         "y": 6.574838,
         "x_norm": 0.126993,
         "y_norm": 0.070876
        }
       ]
      },
      {
       "op": "l",
       "args": [
        {
         "x": 20.882038,
         "y": 6.574838,
         "x_norm": 0.126993,
         "y_norm": 0.070876
        },
        {
         "x": 20.882038,
         "y": 25.267159,
         "x_norm": 0.126993,
         "y_norm": 0.272378
        }
       ]
      },
      {
       "op": "c",
       "args": [
        {
         "x": 20.882038,
         "y": 25.267159,
         "x_norm": 0.126993,
         "y_norm": 0.272378
        },
        {
         "x": 20.882038,
         "y": 26.367619,
         "x_norm": 0.126993,
         "y_norm": 0.284241
        },
        {
         "x": 21.774128,
         "y": 27.259708,
         "x_norm": 0.132419,
         "y_norm": 0.293858
        },
        {
         "x": 22.874599,
         "y": 27.259708,
         "x_norm": 0.139111,
         "y_norm": 0.293858
        }
       ]
      },
      {
       "op": "l",
       "args": [
        {
         "x": 22.874599,
         "y": 27.259708,
         "x_norm": 0.139111,
         "y_norm": 0.293858
        },
        {
         "x": 52.395397,
         "y": 27.259708,
         "x_norm": 0.318641,
         "y_norm": 0.293858
        }
       ]
      },
      {
       "op": "c",
       "args": [
        {
         "x": 52.395397,
         "y": 27.259708,
         "x_norm": 0.318641,
         "y_norm": 0.293858
        },
        {
         "x": 53.495869,
         "y": 27.259708,
         "x_norm": 0.325333,
         "y_norm": 0.293858
        },
        {
         "x": 54.387959,
         "y": 26.367619,
         "x_norm": 0.330759,
         "y_norm": 0.284241
        },
        {
         "x": 54.387959,
         "y": 25.267159,
         "x_norm": 0.330759,
         "y_norm": 0.272378
        }
       ]
      },
      {
       "op": "l",
       "args": [
        {
         "x": 54.387959,
         "y": 25.267159,
         "x_norm": 0.330759,
         "y_norm": 0.272378
        },
        {
         "x": 54.387959,
         "y": 6.574838,
         "x_norm": 0.330759,
         "y_norm": 0.070876
        }
       ]
      },
      {
       "op": "c",
       "args": [
        {
         "x": 54.387959,
         "y": 6.574838,
         "x_norm": 0.330759,
         "y_norm": 0.070876
        },
        {
         "x": 54.387959,
         "y": 5.474378,
         "x_norm": 0.330759,
         "y_norm": 0.059013
        },
        {
         "x": 53.495869,
         "y": 4.582288,
         "x_norm": 0.325333,
         "y_norm": 0.049397
        },
        {
         "x": 52.395397,
         "y": 4.582288,
         "x_norm": 0.318641,
         "y_norm": 0.049397
        }
       ]
      }
     ],
     "close_path": false,
     "even_odd": false,
     "fill_opacity": 0.0,
     "stroke_opacity": 1.0,
     "width": 1.19553,
     "line_cap": [
      0,
      0,
      0
     ],
     "line_join": 0.0,
     "dashes": "[] 0",
     "color": [
      0.12158,
      0.30588,
      0.47452
     ],
     "fill": null
    },
    {
     "primitive_id": "drawing-2",
     "seqno": 2,
     "type": "s",
     "rect": {
      "x0": 13.285448,
      "y0": 56.802029,
      "x1": 61.98455,
      "y1": 79.479462,
      "width": 48.699102,
      "height": 22.677433,
      "x0_norm": 0.080795,
      "y0_norm": 0.612322,
      "x1_norm": 0.376957,
      "y1_norm": 0.856783
     },
     "items": [
      {
       "op": "l",
       "args": [
        {
         "x": 59.991997,
         "y": 56.802029,
         "x_norm": 0.364839,
         "y_norm": 0.612322
        },
        {
         "x": 15.277998,
         "y": 56.802029,
         "x_norm": 0.092913,
         "y_norm": 0.612322
        }
       ]
      },
      {
       "op": "c",
       "args": [
        {
         "x": 15.277998,
         "y": 56.802029,
         "x_norm": 0.092913,
         "y_norm": 0.612322
        },
        {
         "x": 14.177538,
         "y": 56.802029,
         "x_norm": 0.08622,
         "y_norm": 0.612322
        },
        {
         "x": 13.285448,
         "y": 57.694118,
         "x_norm": 0.080795,
         "y_norm": 0.621938
        },
        {
         "x": 13.285448,
         "y": 58.794579,
         "x_norm": 0.080795,
         "y_norm": 0.633801
        }
       ]
      },
      {
       "op": "l",
       "args": [
        {
         "x": 13.285448,
         "y": 58.794579,
         "x_norm": 0.080795,
         "y_norm": 0.633801
        },
        {
         "x": 13.285448,
         "y": 77.486893,
         "x_norm": 0.080795,
         "y_norm": 0.835303
        }
       ]
      },
      {
       "op": "c",
       "args": [
        {
         "x": 13.285448,
         "y": 77.486893,
         "x_norm": 0.080795,
         "y_norm": 0.835303
        },
        {
         "x": 13.285448,
         "y": 78.587379,
         "x_norm": 0.080795,
         "y_norm": 0.847166
        },
        {
         "x": 14.177538,
         "y": 79.479462,
         "x_norm": 0.08622,
         "y_norm": 0.856783
        },
        {
         "x": 15.277998,
         "y": 79.479462,
         "x_norm": 0.092913,
         "y_norm": 0.856783
        }
       ]
      },
      {
       "op": "l",
       "args": [
        {
         "x": 15.277998,
         "y": 79.479462,
         "x_norm": 0.092913,
         "y_norm": 0.856783
        },
        {
         "x": 59.991997,
         "y": 79.479462,
         "x_norm": 0.364839,
         "y_norm": 0.856783
        }
       ]
      },
      {
       "op": "c",
       "args": [
        {
         "x": 59.991997,
         "y": 79.479462,
         "x_norm": 0.364839,
         "y_norm": 0.856783
        },
        {
         "x": 61.092461,
         "y": 79.479462,
         "x_norm": 0.371532,
         "y_norm": 0.856783
        },
        {
         "x": 61.98455,
         "y": 78.587379,
         "x_norm": 0.376957,
         "y_norm": 0.847166
        },
        {
         "x": 61.98455,
         "y": 77.486893,
         "x_norm": 0.376957,
         "y_norm": 0.835303
        }
       ]
      },
      {
       "op": "l",
       "args": [
        {
         "x": 61.98455,
         "y": 77.486893,
         "x_norm": 0.376957,
         "y_norm": 0.835303
        },
        {
         "x": 61.98455,
         "y": 58.794579,
         "x_norm": 0.376957,
         "y_norm": 0.633801
        }
       ]
      },
      {
       "op": "c",
       "args": [
        {
         "x": 61.98455,
         "y": 58.794579,
         "x_norm": 0.376957,
         "y_norm": 0.633801
        },
        {
         "x": 61.98455,
         "y": 57.694118,
         "x_norm": 0.376957,
         "y_norm": 0.621938
        },
        {
         "x": 61.092461,
         "y": 56.802029,
         "x_norm": 0.371532,
         "y_norm": 0.612322
        },
        {
         "x": 59.991997,
         "y": 56.802029,
         "x_norm": 0.364839,
         "y_norm": 0.612322
        }
       ]
      }
     ],
     "close_path": false,
     "even_odd": false,
     "fill_opacity": 0.0,
     "stroke_opacity": 1.0,
     "width": 1.19553,
     "line_cap": [
      0,
      0,
      0
     ],
     "line_join": 0.0,
     "dashes": "[] 0",
     "color": [
      0.12158,
      0.30588,
      0.47452
     ],
     "fill": null
    },
    {
     "primitive_id": "drawing-4",
     "seqno": 4,
     "type": "s",
     "rect": {
      "x0": 102.865601,
      "y0": 56.802029,
      "x1": 151.149597,
      "y1": 79.479462,
      "width": 48.283996,
      "height": 22.677433,
      "x0_norm": 0.625574,
      "y0_norm": 0.612322,
      "x1_norm": 0.919211,
      "y1_norm": 0.856783
     },
     "items": [
      {
       "op": "l",
       "args": [
        {
         "x": 149.157043,
         "y": 56.802029,
         "x_norm": 0.907094,
         "y_norm": 0.612322
        },
        {
         "x": 104.858154,
         "y": 56.802029,
         "x_norm": 0.637691,
         "y_norm": 0.612322
        }
       ]
      },
      {
       "op": "c",
       "args": [
        {